"H73.0"|"Definition"|"Rapid onset inflammation of the tympanic membrane, often causing painful blisters on the tympanum. It may occur with a middle ear infection (otitis mediaotitis media), and it is generally a viral or bacterial infection. Rarely, it may be caused by an infection with mycoplasma pneumoniamycoplasma pneumonia."
"H73.1"|"Definition"|"Persistent or recurrent inflammation of the tympanic membrane, often causing painful blisters on the tympanum. It may occur with a middle ear infection (otitis mediaotitis media), and it is generally a viral or bacterial infection. Rarely, it may be caused by an infection with mycoplasma pneumoniamycoplasma pneumonia."
"H83.0"|"Definition"|"Labyrinthitis is an ear disorder that involves irritation and swelling of the inner ear."
"H92.0"|"Definition"|"Pain in one or both ears"
"H93.0"|"Definition"|"unable to define"
"H93.1"|"Definition"|"A nonspecific symptom of hearing disorder characterized by the sensation of buzzing, ringing, clicking, pulsations, and other noises in the ear in the absence of appropriate corresponding external stimuli."
"I01"|"Definition"|"Rheumatic fever is an inflammatory disease that begins with a strep throat caused by Group A Streptococcusbacteria. It can affect many of the body's connective tissues  especially those of the heart, joints, brain or skin. Rheumatic heart disease is a condition in which the heart valves are damaged by rheumatic fever."
"I50"|"Definition"|"Heart failure is a condition in which the heart can't pump enough blood throughout the body. Heart failure does not mean that your heart has stopped or is about to stop working. It means that your heart is not able to pump blood the way it should"
"I84"|"Definition"|"Hemorrhoids are swollen, inflamed veins around the anus or lower rectum. They are either inside the anus or under the skin around the anus. They often result from straining to have a bowel movement. Other factors include pregnancy, aging and chronic constipation or diarrhea."
"J02"|"Definition"|"Rapid onset inflammation of the pharynx, (back of the throat, between the tonsils and the voicebox (larynx))."
"J02.8"|"Definition"|"Rapid onset inflammation of the pharynx, (back of the throat, between the tonsils and the voicebox (larynx)) due to a specifically identified organism not classified elsewhere."
"J02.9"|"Definition"|"Rapid onset inflammation of the pharynx, (back of the throat, between the tonsils and the voicebox (larynx)) with unspecified etiology."
"J20"|"Definition"|"Rapid onset inflammation of the large airways in the lung, including any part of the bronchi.  It is often viral in origin, e.g.myxovirus (i.e. influenza A,B,C, parainfluenza, HRS virus), adenovirus, and picoma viruses (e.g. rhinoviruses)."
"J20.1"|"Definition"|"Rapid onset inflammation of the large airways in the lung, including any part of the bronchi, due to infection with the haemophilus influenzae virus."
"J30"|"Definition"|"Vasomotor rhinitis is a form of non-allergic inflammation of the nasal mucosa that is characterized by nasal congestion and posterior pharyngeal drainage. Allergic rhinitis is inflammation of the nasal mucosa that is triggered by certain allergens, such as pollen, animal fur, etc."
"J32"|"Definition"|"Persistent or recurrent inflammation of the nasal mucosa in one or more of the paranasal sinuses."
"J35"|"Definition"|"Any persistent or recurrent disease affecting the round-to-oval mass of lymphoid tissue embedded in the lateral wall of the pharynx (tonsils) or the collection of lymphoid nodules on the posterior wall and roof of the nasopharynx (adenoids)"
"J35.0"|"Definition"|"Persistent or recurrent inflammation of the round-to-oval masses of lymphoid tissue embedded in the lateral wall of the pharynx (tonsils)"
"J35.1"|"Definition"|"Unusual enlargement of one or more of the round-to-oval masses of lymphoid tissue embedded in the lateral wall of the pharynx (tonsils).  It can be due to infection"
"J37"|"Definition"|"Persistent or recurrent inflammation of the larynx (airway) and/or the larynx and the cartilaginous and membranous tube descending from the larynx and branching into the right and left main bronchi (trachea)."
"J37.0"|"Definition"|"Persistent or recurrent inflammation of the larynx (airway)"
"J37.1"|"Definition"|"Persistent or recurrent inflammation of the  larynx (major airway) and the trachea (cartilaginous and membranous tube descending from the larynx and branching into the right and left main bronchi)."
"J38.0"|"Definition"|"Loss of function or feeling of one or both of the vocal folds, often caused by injury or disease to the nerves of the larynx."
"J38.7"|"Definition"|"Any other disease which affects the larynx and which is not coded elsewhere."
"J39.2"|"Definition"|"Any other disease which affects the Larynx (the funnel-shaped fibromuscular tube that conducts food to the esophagus, and air to the larynx) and which is not coded elsewhere."
"J45"|"Definition"|"A chronic disease of the bronchial, the air passages leading to and from the lungs characterized by recurrent attacks of breathlessness and wheezing, which vary in severity and frequency from person to person."
"J46"|"Definition"|"Status asthmaticus is a sudden intense and continuous aggravation of a state of asthma, marked by dyspnea to the point of exhaustion and collapse and not responding to the usual therapeutic efforts."
"J64"|"Definition"|"A diffuse parenchymal lung disease, often caused by inhalation of dust and by tissue reaction to their presence."
"J81"|"Definition"|"Pulmonary edema is a condition caused by excess fluid in the lungs. This fluid collects in the numerous air sacs in the lungs, making it difficult to breathe."
"J86"|"Definition"|"Suppurative inflammation of the pleural space."
"J90"|"Definition"|"Presence of fluid in the pleural cavity resulting from excessive transudation or exudation from the pleural surfaces."
"J94"|"Definition"|"Any other condition effecting the thin serous membrane enveloping the lungs and lining the thoracic cavity"
"K05"|"Definition"|"Gingivitis is inflammation of the gum tissues (gingiva) without loss of connective tissue.#Periodontal disease can refer to any pathological process involving the the gum (GINGIVA), the alveolar bone (alveolar process), the dental cementum, and / or the periodontal ligament"
"K12"|"Definition"|"Inflammation of the soft tissues of the mouth, such as mucosa; palate; gingiva; and / or lip, as well as any associated any pathological or traumatic discontinuity of tissue"
"K12.1"|"Definition"|"Other types of inflammation of the soft tissues of the mouth, such as mucosa; palate; gingiva; and / or lip."
"K13"|"Definition"|"Any other condition affecting the lip and/or oral mucosa"
"K13.0"|"Definition"|"Any condition effecting the lips"
"K14.5"|"Definition"|"Plicated tongue, also called lingua dissects, fissured tongue, or scrotal tongue, represents a change in the dorsal surface of the anterior two thirds of the tongue."
"K20"|"Definition"|"Inflammation of the esophagus, the tube that leads from the back of the mouth to the stomach."
"K22.0"|"Definition"|"Achalasia is a disorder of the tube that carries food from the mouth to the stomach (esophagus) due to a failure of the lower esophageal sphincter to relax, which affects the ability of the esophagus to move food toward the stomach"
"K22.3"|"Definition"|"An opening or hole in the esophagus, the tube through which food passes from the mouth to the stomach."
"K29"|"Definition"|"Gastritis refers to inflammation of the mucosa lining of the stomach.  #Duodenitis refers to inflammation of the duodenal mucosa."
"K29.0"|"Definition"|"Rapid onset inflammation of the mucosal lining of the stomach with associated belleding or abnormal blood flow."
"K29.1"|"Definition"|"Rapid onset inflammation of the mucosal lining of the stomach due to cause not otherwise coded"
"K29.2"|"Definition"|"Inflammation of the gastric mucosa due to alcohol use"
"K29.3"|"Definition"|"Persistent or recurrent inflammation of the lamina propria, limited to the outer third of the mucosa in the foveolar area."
"K29.4"|"Definition"|"Persistent or recurrent inflammation of the gastric mucosa with atrophy leading to decreased hydrochloric acid concentration in the gastric juice. Atrophic gastritis frequently progresses from chronic gastritis."
"K29.5"|"Definition"|"Persistent or recurrent inflammation of the lamina propria, limited to the outer third of the mucosa in the foveolar area of unspecified origin."
"K35.9"|"Definition"|"Acute inflammation of the vermiform appendix."
"K40"|"Definition"|"A hernia occurs when part of an internal organ bulges through a weak area of muscle. Most hernias occur in the abdomen. Inguinal hernia is the most common type and is in the groin."
"K42"|"Definition"|"A hernia occurs when part of an internal organ bulges through a weak area of muscle. Most hernias occur in the abdomen. Umbilical, as one type of hernia, is around the belly button. "
"K43.1"|"Definition"|"A hernia caused by weakness of the anterior ABDOMINAL WALL due to midline defects, previous incisions, or increased intra-abdominal pressure WITH concomitant death and putrefaction of tissue usually due to a loss of blood supply"
"K50.0"|"Definition"|"A chronic inflammatory bowel disease affecting the small intestine"
"K50.1"|"Definition"|"A chronic inflammatory bowel disease affecting the large intestine"
"K55"|"Definition"|"Intestinal ischemia characterized by blood supply to the gastrointestinal tract that is inadequate to meet its metabolic demand"
"K55.1"|"Definition"|"Long standing intestinal ischemia characterized by blood supply to the gastrointestinal tract that is inadequate to meet its metabolic demand"
"K55.8"|"Definition"|"Other causes of intestinal ischemia characterized by blood supply to the gastrointestinal tract that is inadequate to meet its metabolic demand"
"K56"|"Definition"|"A series of disorders resulting in decreased or aborted intestinal motility without intestinal hernia"
"K56.0"|"Definition"|"A type of ILEUS, a functional not mechanical obstruction of the INTESTINES. This syndrome is caused by a large number of disorders involving the smooth muscles (MUSCLE, SMOOTH) or the NERVOUS SYSTEM."
"K58.0"|"Definition"|"As parent above, with diarrhea"
"K58.9"|"Definition"|"As parent above, without diarrhea"
"K59"|"Definition"|"A group of bowel disorders which are characterised by chronic abdominal complaints without a structural or biochemical cause that could explain symptoms"
"K59.0"|"Definition"|"Infrequent or difficult evacuation of FECES. These symptoms are associated with a variety of causes, including low DIETARY FIBER intake, emotional or nervous disturbances, systemic and structural disorders, drug-induced aggravation, and infections."
"K59.1"|"Definition"|"Frequent or urgent passage of loose or watery stool with no identifiable cause"
"K59.9"|"Definition"|"A group of bowel disorders which are characterised by chronic abdominal complaints without a structural or biochemical cause that could explain symptoms [NOS]"
"K61.0"|"Definition"|"An infected cavity filled with pus found near the anus or rectum resulting from an acute infection of a small gland just inside the anus, when bacteria or foreign matter enters the tissue through the gland. Certain conditions - colitis or other inflammation of the intestine, for example - can sometimes make these infections more likely.  The abscess is usually associated with symptoms of pain and swelling around the anus. Individuals may also experience fatigue, fevers and chills. "
"K62"|"Definition"|"Swollen veins in the lower part of the RECTUM or ANUS. Hemorrhoids can be inside the anus (internal), under the skin around the anus (external), or protruding from inside to outside of the anus. People with hemorrhoids may or may not exhibit symptoms which include bleeding, itching, and pain."
"K62.5"|"Definition"|"As parent above, external without complications"
"K73"|"Definition"|"INFLAMMATION of the LIVER with ongoing hepatocellular injury for 6 months or more, characterized by NECROSIS of HEPATOCYTES and inflammatory cell (LEUKOCYTES) infiltration. Chronic hepatitis can be caused by viruses, medications, autoimmune diseases, and other unknown factors."
"K74"|"Definition"|"Liver disease in which the normal microcirculation, the gross vascular anatomy, and the hepatic architecture have been variably destroyed and altered with fibrous septa surrounding regenerated or regenerating parenchymal nodules"
"K82"|"Definition"|"Any other definite pathologic process with a characteristic set of signs and symptoms effecting the gallbladder"
"K82.1"|"Definition"|"Abnormal accumulation of serous fluid in the gallbladder"
"K85"|"Definition"|"Rapid onset inflammation of the pancreas which does not present with computed tomographic or endoscopic retrograde cholaniopancreatic findings of chronic pancreatitis."
"K86.1"|"Definition"|"Persistent or recurrent inflammation of the pancreas which may present with specific computed tomographic or endoscopic retrograde cholaniopancreatic findings."
"K86.8"|"Definition"|"Any other definite pathologic process with a characteristic set of signs and symptoms effecting the pancreas"
"K90"|"Definition"|"Defective transport of nutrients or water through the intestinal mucous membrane due to infectious, autoimmune, enzymatic and dysproteinemic lesions or other causes."
"K90.9"|"Definition"|"Defective transport of nutrients or water through the intestinal mucous membrane due to unspecified etiology"
"K92.0"|"Definition"|"Vomiting of blood that is either fresh bright red, or older ""coffee-ground"" in character. It generally indicates bleeding of theupper gastrointestinal track."
"L02"|"Definition"|"An abscess is a localized collection of pus in any part of the body that is surrounded by swelling (inflammation).#A furuncle (boil) is a skin infection involving an entire hair follicle and nearby skin tissue.#A carbuncle is a skin infection that often involves a group of hair follicles. The infected material forms a lump, called mass, which occurs deep in the skin."
"L02.0"|"Definition"|"Abscess of the face: a localized collection of pus in the skin of the face that is surrounded by swelling (inflammation).#Furuncle (boil) of the face: an infection in the skin of the face involving an entire hair follicle and nearby skin tissue.#Carbuncle of the face: a skin infection that often involves a group of hair follicles on the face. The infected material forms a lump, called mass, which occurs deep in the skin."
"L02.1"|"Definition"|"Abscess of the neck: a localized collection of pus in the skin of the neck that is surrounded by swelling (inflammation).#Furuncle (boil) of the neck: an infection in the skin of the neck involving an entire hair follicle and nearby skin tissue.#Carbuncle of the neck: a skin infection that often involves a group of hair follicles on the neck. The infected material forms a lump, called mass, which occurs deep in the skin."
"L02.2"|"Definition"|"Abscess of the trunk: a localized collection of pus in the skin of the trunk that is surrounded by swelling (inflammation).#Furuncle (boil) of the trunk: an infection in the skin of the trunk involving an entire hair follicle and nearby skin tissue.#Carbuncle of the trunk: a skin infection that often involves a group of hair follicles on the trunk. The infected material forms a lump, called mass, which occurs deep in the skin."
"L02.3"|"Definition"|"Abscess of the buttock: a localized collection of pus in the skin of the buttock that is surrounded by swelling (inflammation).#Furuncle (boil) of the buttock: an infection in the skin of the buttock involving an entire hair follicle and nearby skin tissue.#Carbuncle of the buttock: a skin infection that often involves a group of hair follicles on the buttock. The infected material forms a lump, called mass, which occurs deep in the skin."
"L02.4"|"Definition"|"Abscess of the limb: a localized collection of pus in the skin of the limb that is surrounded by swelling (inflammation).#Furuncle (boil) of the limb: an infection in the skin of the limb involving an entire hair follicle and nearby skin tissue.#Carbuncle of the limb: a skin infection that often involves a group of hair follicles on the limb. The infected material forms a lump, called mass, which occurs deep in the skin."
"L02.8"|"Definition"|"Abscess: a localized collection of pus in the skin of another site that is surrounded by swelling (inflammation).#Furuncle (boil): an infection in the skin of another site involving an entire hair follicle and nearby skin tissue.#Carbuncle: a skin infection that often involves a group of hair follicles on another site. The infected material forms a lump, called mass, which occurs deep in the skin."
"L02.9"|"Definition"|"Abscess: a localized collection of pus in the skin of an unspecified site that is surrounded by swelling (inflammation).#Furuncle (boil): an infection in the skin of an unspecified site involving an entire hair follicle and nearby skin tissue.#Carbuncle: a skin infection that often involves a group of hair follicles on an unspecified site. The infected material forms a lump, called mass, which occurs deep in the skin."
"L03"|"Definition"|"An acute, diffuse, and suppurative inflammation of loose connective tissue, particularly the deep subcutaneous tissues, and sometimes muscle, which is most commonly seen as a result of infection of a wound, ulcer, or other skin lesions."
"L03.0"|"Definition"|"An acute, diffuse, and suppurative inflammation of loose connective tissue, particularly the deep subcutaneous tissues, and sometimes muscle of the finger and toe, which is most commonly seen as a result of infection of a wound, ulcer, or other skin lesions."
"L03.8"|"Definition"|"An acute, diffuse, and suppurative inflammation of loose connective tissue, particularly the deep subcutaneous tissues, and sometimes muscle of other sites, which is most commonly seen as a result of infection of a wound, ulcer, or other skin lesions."
"L04.1"|"Definition"|"Rapid onset inflammation of the lymph nodes of the trunk"
"L08.0"|"Definition"|"Any purulent skin disease involving either free skin or the adnexal structures. "
"L13"|"Definition"|"Any other condition which includes the development of blisters, the accumulation of fluid between cells in the upper layers of the skin, specifically the epidermis (top layers) or dermis (layer between the epidermis). The type of disease depends upon what level in the skin the blisters form and where they are located on the body."
"L13.9"|"Definition"|"Any unspecified condition which includes the development of blisters, the accumulation of fluid between cells in the upper layers of the skin, specifically the epidermis (top layers) or dermis (layer between the epidermis). "
"L20"|"Definition"|"A chronic inflammatory genetically determined disease of the skin marked by increased ability to form reagin (IgE), with increased susceptibility to allergic rhinitis and asthma, and hereditary disposition to a lowered threshold for pruritus. It is manifested by lichenification, excoriation, and crusting, mainly on the flexural surfaces of the elbow and knee."
"L20.8"|"Definition"|"Any other chronic inflammatory genetically determined disease of the skin marked by increased ability to form reagin (IgE), with increased susceptibility to allergic rhinitis and asthma, and hereditary disposition to a lowered threshold for pruritus. It is manifested by lichenification, excoriation, and crusting, mainly on the flexural surfaces of the elbow and knee."
"L21"|"Definition"|"A chronic inflammatory disease of the skin with unknown etiology. It is characterized by moderate erythema, dry, moist, or greasy  scaling and yellow crusted patches on various areas, especially the scalp, that exfoliate as dandruff. Seborrheic dermatitis is common in children and adolescents with HIV infection."
"L23"|"Definition"|"A type of acute or chronic skin reaction in which sensitivity is manifested by reactivity to allergic sensitization to various substances coming in contact with the skin. These substances subsequently produce inflammatory reactions in the skin of those who have acquired hypersensitivity to them as a result of prior exposure."
"L24"|"Definition"|"A type of acute or chronic skin reaction in which sensitivity is manifested by reactivity to irritating materials or substances coming in contact with the skin"
"L24.8"|"Definition"|"A type of acute or chronic skin reaction in which sensitivity is manifested by reactivity to other irritating materials or substances coming in contact with the skin"
"L25.5"|"Definition"|"A type of acute or chronic skin reaction in which sensitivity is manifested by reactivity to various plant substances coming in contact with the skin. These substances subsequently produce inflammatory reactions in the skin of those who have acquired hypersensitivity to them as a result of prior exposure."
"L26"|"Definition"|"Any inflammation of the skin which causes scaling and / or exfoliation of the skin"
"L29"|"Definition"|"An intense itching sensation that produces the urge to rub or scratch the skin to obtain relief."
"L29.1"|"Definition"|"An intense itching sensation that produces the urge to rub or scratch the skin of the scrotum to obtain relief."
"L30"|"Definition"|"Any other inflammation of the skin"
"L30.3"|"Definition"|"Any inflammation of the skin which is transmittable to others"
"L40"|"Definition"|"A common genetically determined, chronic, inflammatory skin disease characterized by rounded erythematous, dry, scaling patches. The lesions have a predilection for nails, scalp, genitalia, extensor surfaces, and the lumbosacral region. Accelerated epidermopoiesis is considered to be the fundamental pathologic feature in psoriasis."
"L40.3"|"Definition"|"A rare skin eruption that is characterized by acute, extensive formation of sterile pustules on the skin of the palms of the hands and soles of the feet, fever, and peripheral blood leukocytosis."
"L43"|"Definition"|"An inflammatory, pruritic disease of the skin and mucous membranes, which can be either generalized or localized. It is characterized by distinctive purplish, flat-topped papules having a predilection for the trunk and flexor surfaces. The lesions may be discrete or coalesce to form plaques. Histologically, there is a ""saw-tooth"" pattern of epidermal hyperplasia and vacuolar alteration of the basal layer of the epidermis along with an intense upper dermal inflammatory infiltrate composed predominantly of T-cells. Etiology is unknown."
"L51"|"Definition"|"A skin and mucous membrane disease characterized by an eruption of macules, papules, nodules, vesicles, and/or bullae with characteristic ""bull's-eye"" lesions usually occurring on the dorsal aspect of the hands and forearms."
"L52"|"Definition"|"An erythematous eruption commonly associated with drug reactions or infection and characterized by inflammatory nodules that are usually tender, multiple, and bilateral. These nodules are located predominantly on the shins with less common occurrence on the thighs and forearms. They undergo characteristic color changes ending in temporary bruise-like areas. This condition usually subsides in 3-6 weeks without scarring or atrophy."
"L55"|"Definition"|"An injury to the skin causing erythema, tenderness, and sometimes blistering and resulting from excessive exposure to the sun. The reaction is produced by the ultraviolet radiation in sunlight."
"L56.3"|"Definition"|"A vascular reaction of the skin characterized by erythema and wheal formation due to localized increase of vascular permeability as a result of exposure to the sun."
"L63"|"Definition"|"A microscopically inflammatory, usually reversible, patchy hair loss occurring in sharply defined areas and usually involving the beard or scalp"
"L70"|"Definition"|"Localized skin inflammation as a result of overactivity of the oil glands at the base of hair follicles. "
"L74"|"Definition"|"Disorder of eccrine sweat, also called miliaria, is due to the occlusion of the eccrine glands, with the subsequent retention of sweat within the skin."
"L74.0"|"Definition"|"A syndrome of cutaneous changes associated with sweat retention and extravasation of sweat at different levels in the skin resulting from apocrine duct obstruction. The sweat then seeps into the epidermis, producing pruritic erythematous papulovesicles. Also known as prickly heat."
"L74.4"|"Definition"|"Abnormally diminished or absent perspiration. Both generalized and segmented (reduced or absent sweating in circumscribed locations) forms of the disease are usually associated with other underlying conditions."
"L75.1"|"Definition"|"A rare condition characterized by the secretion of colored sweat. It is caused by the deposition of lipofuscin in the sweat glands. "
"L80"|"Definition"|"A disorder consisting of areas of macular depigmentation, commonly on extensor aspects of extremities, on the face or neck, and in skin folds. Age of onset is often in young adulthood and the condition tends to progress gradually with lesions enlarging and extending until a quiescent state is reached."
"L81.1"|"Definition"|"Disorders of increased melanin pigmentation that develop without preceding inflammatory disease that result in patchy brown or dark brown skin discoloration."
"L82"|"Definition"|"Benign adnexal neoplasms that present as multiple oval, brown-to-black plaques, located mostly on the chest and back. The age of onset is usually in the fourth or fifth decade."
"L83"|"Definition"|"A circumscribed melanosis consisting of a brown-pigmented, velvety verrucosity or fine papillomatosis appearing in the axillae and other body folds. It occurs in association with endocrine disorders, underlying malignancy, administration of certain drugs, or as in inherited disorder."
